{
  "_meta": {
    "issue": "#171 Rebuild ścieżek — P1 AI w domu (formatywna)",
    "interaction": "Klasyfikacja: zdrowa vs ryzykowna praktyka rodzinna (kind: classify)",
    "dataPolicy": "WSZYSTKIE przykłady SYNTETYCZNE (NotkaApp, przyklad.test, Jan Syntetyczny, Anna Testowa). ZERO realnych danych/PII. Moduł formatywny — bez progu zaliczenia i certyfikatu."
  },
  "module": "MD5",
  "intro": "Діти не питають, чи користуватися ШІ — вони вже користуються: для уроків, малюнків, розмов із чат-ботами. Питання в тому, чи роблять це з тобою, чи поруч із тобою. Цей модуль допомагає говорити про ШІ без залякування і без сліпого захвату, встановити здорові правила і відрізнити допомогу в навчанні від виконання роботи замість дитини.",
  "screens": [
    {
      "id": "md5-s1-rozmowa",
      "title": "Як говорити з дитиною про ШІ",
      "type": "content",
      "blocks": [
        { "kind": "paragraph", "text": "Найкраща перша розмова про ШІ — це не лекція, а спільний експеримент: сядьте разом, запитайте чат про щось, на чому дитина знається (улюблена гра, тварина, команда) — і пошукайте разом, що ШІ сказав добре, а де помиляється. Дитина, яка раз упіймає ШІ на помилці, запамʼятає більше, ніж із десяти повчань." },
        { "kind": "list", "items": [
          "Говори просто: «ШІ вгадує дуже добре, але не знає напевно — тому перевіряємо».",
          "Не залякуй і не захоплюйся сліпо — обидва крайні тони закривають розмову.",
          "Домовся, що з дивною, тривожною або «занадто дорослою» відповіддю дитина приходить до тебе — без покарання за саме запитання."
        ] },
        { "kind": "callout", "variant": "safe", "title": "Золота фраза", "text": "«ШІ — це дуже начитаний помічник, який часом вигадує — і ніколи не є твоїм другом чи дорослим, якому розповідають секрети»." }
      ]
    },
    {
      "id": "md5-s2-zasady",
      "title": "Спільні правила замість заборон",
      "type": "content",
      "blocks": [
        { "kind": "paragraph", "text": "Повна заборона працює до першої перерви у школі — в однокласників є телефони. Ефективніші правила, встановлені разом, відповідні до віку, з ясним «чому»:" },
        { "kind": "table", "headers": ["Сфера", "Приклад правила", "Чому"], "rows": [
          ["Дані", "Не даємо ШІ імені, адреси, школи і фото", "чат — це не щоденник; вміст іде на сервер"],
          ["Час і місце", "ШІ на спільному пристрої, у видному місці (молодші діти)", "присутність дорослого замість стеження"],
          ["Контент", "Дивні/тривожні відповіді показуємо батькам", "фільтри не ловлять усього"],
          ["Школа", "ШІ допомагає зрозуміти, а не робить за тебе", "оцінка має вимірювати твою голову"]
        ], "textAlt": "Таблиця сімейних правил: захист даних дитини, користування у видному місці, повідомлення про тривожний контент, ШІ як допомога в розумінні замість виконання завдань." },
        { "kind": "callout", "variant": "info", "title": "Батьківський контроль", "text": "Вмикай дитячі режими і фільтри там, де вони є — але стався до них як до пасків безпеки, а не як до водія. Жоден фільтр не замінить розмови." }
      ]
    },
    {
      "id": "md5-s3-nauka",
      "title": "Допомога в навчанні чи виконання за дитину",
      "type": "content",
      "blocks": [
        { "kind": "paragraph", "text": "Межу просто назвати і важко пильнувати: ШІ допомагає, коли після його використання дитина вміє БІЛЬШЕ; робить за неї, коли вміє стільки ж, а має готовий результат. Той самий інструмент робить і одне, і друге — різниця сидить у способі використання." },
        { "kind": "list", "items": [
          "Допомога: «поясни мені дроби на прикладі піци», «постав мені пʼять запитань із цього розділу», «перевір мій твір і скажи, що поправити — без писання за мене».",
          "Виконання за дитину: «напиши твір про Шевченка на завтра», «розвʼяжи ці задачі» — і копіюй-вставляй у зошит.",
          "Домашній тест: попроси дитину пояснити тобі результат власними словами. Вміє? Була допомога. Не вміє? Було виконання за неї."
        ] },
        { "kind": "callout", "variant": "warn", "title": "Довга ціна", "text": "Виконання за дитину заощаджує вечір, а коштує вміння. Дитина, яка навчиться «ШІ зробить за мене», на контрольній, на іспиті і на першій роботі залишається сама." }
      ]
    },
    {
      "id": "md5-s4-higiena",
      "title": "Цифрова гігієна всієї родини",
      "type": "content",
      "blocks": [
        { "kind": "paragraph", "text": "Діти копіюють не правила, а поведінку. Якщо хтось із батьків за обідом «лише перевірить чат», правило «спершу люди, потім екрани» вмирає на практиці. Цифрова гігієна працює, коли стосується всіх:" },
        { "kind": "list", "ordered": true, "items": [
          "Зони без екранів: спільні прийоми їжі, година перед сном — для дорослих теж.",
          "«Товариський» чат-бот — не повірник: почуття і секрети обговорюємо з людьми; дитина має знати, що розмова з ботом не є приватною, як щоденник.",
          "Раз на місяць спільний огляд: чого ШІ нас останнім часом навчив, де помилився, що змінюємо у правилах."
        ] },
        { "kind": "callout", "variant": "safe", "title": "Мета", "text": "Ми виховуємо не дитину, яка не користується ШІ, — а таку, яка користується ним свідомо і знає, коли відкласти." }
      ]
    }
  ],
  "interaction": {
    "kind": "classify",
    "id": "md5-classify",
    "title": "Здорова чи ризикована сімейна практика?",
    "intro": "Оціни домашні практики, повʼязані з ШІ. Фідбек пояснює, що зміцнює, а що підриває безпеку і розвиток дитини.",
    "categories": [
      { "id": "healthy", "label": "Здорова практика", "desc": "Спільність, розмова, навчання мислення, захист даних дитини." },
      { "id": "risky", "label": "Ризикована практика", "desc": "Виконання за дитину, дані дитини в мережі, ШІ як няня або повірник." }
    ],
    "items": [
      { "id": "md5-i1", "text": "Батько чи мати разом із дитиною ловлять ШІ на помилці в темі, на якій дитина знається.", "correctCategory": "healthy", "rationale": "Вчить здорового скептицизму краще за лекцію — дитина відчуває на собі, що ШІ помиляється." },
      { "id": "md5-i2", "text": "Восьмирічна дитина вечорами сама розмовляє з чат-ботом «другом» про свої смутки.", "correctCategory": "risky", "rationale": "Бот — не повірник: емоції дитини потребують людини, а вміст розмов іде на сервер." },
      { "id": "md5-i3", "text": "Підліток просить ШІ про пʼять перевірних запитань перед контрольною і відповідає на них сам.", "correctCategory": "healthy", "rationale": "ШІ як тренер знань — після використання дитина вміє більше, а не менше." },
      { "id": "md5-i4", "text": "Батько чи мати вставляє в публічний чат характеристику зі школи з імʼям і прізвищем дитини, просячи аналіз.", "correctCategory": "risky", "rationale": "Дані дитини в публічному інструменті — аналіз можливий після анонімізації." },
      { "id": "md5-i5", "text": "Твір на завтра пише ШІ, дитина переписує в зошит, дорослий «не бачить».", "correctCategory": "risky", "rationale": "Виконання за дитину з мовчазної згоди дорослого — подвійний урок: не вмію і не мушу." },
      { "id": "md5-i6", "text": "Родина за вечерею разом встановлює правила ШІ, включно з правилами для батьків.", "correctCategory": "healthy", "rationale": "Правила, створені спільно і симетричні, мають шанс виконуватися." },
      { "id": "md5-i7", "text": "Планшет із чат-ботом як «няня» на цілий день, щоб було тихо.", "correctCategory": "risky", "rationale": "ШІ без присутності дорослого як опікун — ані фільтр, ані бот не замінять уваги." },
      { "id": "md5-i8", "text": "Дитина показує батькам дивну відповідь чату, і ви разом повідомляєте про неї в застосунку.", "correctCategory": "healthy", "rationale": "Працює домовленість «приходиш без покарання» + дитина вчиться реагувати, а не лише уникати." }
    ]
  },
  "summary": {
    "points": [
      "Розмовляй через спільні експерименти, а не лекції — нехай дитина впіймає ШІ на помилці.",
      "Правила замість заборон: дані захищаємо, тривожний контент повідомляємо, ШІ допомагає розуміти, а не робить за дитину.",
      "Цифрова гігієна стосується і дорослих — діти копіюють поведінку, а не регламенти."
    ],
    "checklist": [
      "Чи знає моя дитина, чого не давати ШІ (імʼя, адреса, школа, фото)?",
      "Чи маємо домовленість: дивна відповідь = показуєш мені без наслідків?",
      "Чи вмію я відрізнити, коли ШІ вчить, а коли робить за дитину — і чи роблю цей тест?"
    ],
    "checklistTitle": "Чекліст — ШІ в родині",
    "nextStep": "Наступний крок: останній модуль шляху — домашня приватність, тобто налаштування акаунтів ШІ і порядок у даних усього дому."
  }
}
